{
  "$schema": "http://json-schema.org/draft-07/schema#",
  "title": "UI Spec Schema",
  "type": "object",
  "required": [
    "page"
  ],
  "properties": {
    "page": {
      "type": "string",
      "pattern": "^[A-Za-z][A-Za-z0-9_]*$"
    },
    "route": {
      "type": "string"
    },
    "layout": {
      "type": [
        "object",
        "null"
      ],
      "properties": {
        "type": {
          "type": "string"
        },
        "cols": {
          "type": "integer"
        },
        "gap": {
          "type": "string"
        }
      },
      "additionalProperties": true
    },
    "sections": {
      "type": "array",
      "items": {
        "$ref": "#/definitions/node"
      }
    },
    "children": {
      "type": "array",
      "items": {
        "$ref": "#/definitions/node"
      }
    }
  },
  "definitions": {
    "node": {
      "type": "object",
      "required": [
        "type"
      ],
      "properties": {
        "type": {
          "type": "string"
        },
        "id": {
          "type": "string"
        },
        "props": {
          "type": "object",
          "additionalProperties": true
        },
        "text": {
          "type": "string"
        },
        "gridArea": {
          "type": "object",
          "properties": {
            "from": {
              "type": "integer"
            },
            "to": {
              "type": "integer"
            }
          },
          "additionalProperties": false
        },
        "children": {
          "type": "array",
          "items": {
            "$ref": "#/definitions/node"
          }
        }
      },
      "additionalProperties": false
    }
  },
  "additionalProperties": false
}